publication_date,effective_on,agencies,agency_names,title,abstract,action,type,president,dates,citation,document_number,regulation_id_numbers,json_url,raw_text_url,html_url,president_id,publication_dt,publication_year,publication_month,susp,actual_susp
2017-03-06,2017-03-03,"[{'raw_name': 'DEPARTMENT OF HEALTH AND HUMAN SERVICES', 'name': 'Health and Human Services Department', 'id': 221, 'url': 'https://www.federalregister.gov/agencies/health-and-human-services-department', 'json_url': 'https://www.federalregister.gov/api/v1/agencies/221', 'parent_id': None, 'slug': 'health-and-human-services-department'}, {'raw_name': 'Centers for Medicare & Medicaid Services', 'name': 'Centers for Medicare & Medicaid Services', 'id': 45, 'url': 'https://www.federalregister.gov/agencies/centers-for-medicare-medicaid-services', 'json_url': 'https://www.federalregister.gov/api/v1/agencies/45', 'parent_id': 221, 'slug': 'centers-for-medicare-medicaid-services'}]","Health and Human Services Department, Centers for Medicare & Medicaid Services","Medicaid and Children's Health Insurance Program (CHIP) Programs; Medicaid Managed Care, CHIP Delivered in Managed Care, and Revisions Related to Third Party Liability; Corrections","This document corrects technical errors that appeared in the correcting amendment published in the January 3, 2017 Federal Register (82 FR 37 through 40) entitled, ``Medicaid and Children's Health Insurance Program (CHIP) Programs; Medicaid Managed Care, CHIP Delivered in Managed Care, and Revisions Related to Third Party Liability; Corrections.''",Final rule; correcting amendment.,Rule,"{'name': 'Donald Trump', 'identifier': 'donald-trump'}","Effective Date: This correcting document is effective March 3, 2017.",82 FR 12509,2017-04307,,https://www.federalregister.gov/api/v1/documents/2017-04307?publication_date=2017-03-06,https://www.federalregister.gov/documents/full_text/text/2017/03/06/2017-04307.txt,https://www.federalregister.gov/documents/2017/03/06/2017-04307/medicaid-and-childrens-health-insurance-program-chip-programs-medicaid-managed-care-chip-delivered,donald-trump,2017-03-06 00:00:00 UTC,2017,3,0,0
2017-03-24,2017-03-24,"[{'raw_name': 'DEPARTMENT OF AGRICULTURE', 'name': 'Agriculture Department', 'id': 12, 'url': 'https://www.federalregister.gov/agencies/agriculture-department', 'json_url': 'https://www.federalregister.gov/api/v1/agencies/12', 'parent_id': None, 'slug': 'agriculture-department'}, {'raw_name': 'Animal and Plant Health Inspection Service', 'name': 'Animal and Plant Health Inspection Service', 'id': 22, 'url': 'https://www.federalregister.gov/agencies/animal-and-plant-health-inspection-service', 'json_url': 'https://www.federalregister.gov/api/v1/agencies/22', 'parent_id': 12, 'slug': 'animal-and-plant-health-inspection-service'}]","Agriculture Department, Animal and Plant Health Inspection Service",Importation of Lemons From Northwest Argentina; Stay of Regulations,"On December 23, 2016, we published a final rule amending the fruits and vegetables regulations to allow the importation of lemons from northwest Argentina into the continental United States under certain conditions. In a document published on January 25, 2017, we stayed the regulations for 60 days ending March 27, 2017. In this document, we are issuing an additional stay of those regulations.",Final rule; stay of regulations.,Rule,"{'name': 'Donald Trump', 'identifier': 'donald-trump'}","Effective March 24, 2017, 7 CFR 319.28(e) and 319.56-76, added December 23, 2016 (81 FR 94217), and stayed on January 25, 2017 (82 FR 8353), until March 27, 2017, continue to be stayed until May 26, 2017.",82 FR 14987,2017-05877,0579-AE17,https://www.federalregister.gov/api/v1/documents/2017-05877?publication_date=2017-03-24,https://www.federalregister.gov/documents/full_text/text/2017/03/24/2017-05877.txt,https://www.federalregister.gov/documents/2017/03/24/2017-05877/importation-of-lemons-from-northwest-argentina-stay-of-regulations,donald-trump,2017-03-24 00:00:00 UTC,2017,3,0,1
2017-03-15,2017-03-27,"[{'raw_name': 'DEPARTMENT OF HOMELAND SECURITY', 'name': 'Homeland Security Department', 'id': 227, 'url': 'https://www.federalregister.gov/agencies/homeland-security-department', 'json_url': 'https://www.federalregister.gov/api/v1/agencies/227', 'parent_id': None, 'slug': 'homeland-security-department'}, {'raw_name': 'Coast Guard', 'name': 'Coast Guard', 'id': 53, 'url': 'https://www.federalregister.gov/agencies/coast-guard', 'json_url': 'https://www.federalregister.gov/api/v1/agencies/53', 'parent_id': 227, 'slug': 'coast-guard'}]","Homeland Security Department, Coast Guard","Drawbridge Operation Regulation; Mianus River, Greenwich, CT","The Coast Guard has issued a temporary deviation from the operating schedule that governs the Metro-North Bridge across the Mianus River, mile 1.0 at Greenwich, Connecticut. This deviation is necessary in order to complete required maintenance including installation of new timber ties, miter rails, and steel repairs.",Notice of deviation from drawbridge regulation.,Rule,"{'name': 'Donald Trump', 'identifier': 'donald-trump'}","This deviation is effective from 12:01 a.m. on March 27, 2017 through 12:01 a.m. on May 9, 2017.",82 FR 13756,2017-05069,,https://www.federalregister.gov/api/v1/documents/2017-05069?publication_date=2017-03-15,https://www.federalregister.gov/documents/full_text/text/2017/03/15/2017-05069.txt,https://www.federalregister.gov/documents/2017/03/15/2017-05069/drawbridge-operation-regulation-mianus-river-greenwich-ct,donald-trump,2017-03-15 00:00:00 UTC,2017,3,0,0
2017-03-27,2017-04-11,"[{'raw_name': 'DEPARTMENT OF TRANSPORTATION', 'name': 'Transportation Department', 'id': 492, 'url': 'https://www.federalregister.gov/agencies/transportation-department', 'json_url': 'https://www.federalregister.gov/api/v1/agencies/492', 'parent_id': None, 'slug': 'transportation-department'}, {'raw_name': 'Federal Aviation Administration', 'name': 'Federal Aviation Administration', 'id': 159, 'url': 'https://www.federalregister.gov/agencies/federal-aviation-administration', 'json_url': 'https://www.federalregister.gov/api/v1/agencies/159', 'parent_id': 492, 'slug': 'federal-aviation-administration'}]","Transportation Department, Federal Aviation Administration",Airworthiness Directives; Sikorsky Aircraft Corporation Helicopters,We are adopting a new airworthiness directive (AD) for Sikorsky Aircraft Corporation (Sikorsky) Model 269D and Model 269D Configuration A helicopters. This AD requires reducing the life limit of and inspecting certain drive shafts. This AD is prompted by four incidents involving failure of a drive shaft. The actions specified by this AD are intended to prevent the unsafe condition on these products.,Final rule; request for comments.,Rule,"{'name': 'Donald Trump', 'identifier': 'donald-trump'}","This AD becomes effective April 11, 2017.",82 FR 15120,2017-05967,2120-AA64,https://www.federalregister.gov/api/v1/documents/2017-05967?publication_date=2017-03-27,https://www.federalregister.gov/documents/full_text/text/2017/03/27/2017-05967.txt,https://www.federalregister.gov/documents/2017/03/27/2017-05967/airworthiness-directives-sikorsky-aircraft-corporation-helicopters,donald-trump,2017-03-27 00:00:00 UTC,2017,3,0,0
2017-03-03,2017-04-03,"[{'raw_name': 'DEPARTMENT OF HOMELAND SECURITY', 'name': 'Homeland Security Department', 'id': 227, 'url': 'https://www.federalregister.gov/agencies/homeland-security-department', 'json_url': 'https://www.federalregister.gov/api/v1/agencies/227', 'parent_id': None, 'slug': 'homeland-security-department'}, {'raw_name': 'Coast Guard', 'name': 'Coast Guard', 'id': 53, 'url': 'https://www.federalregister.gov/agencies/coast-guard', 'json_url': 'https://www.federalregister.gov/api/v1/agencies/53', 'parent_id': 227, 'slug': 'coast-guard'}]","Homeland Security Department, Coast Guard","Safety Zone; Columbia River, Sand Island, WA","The Coast Guard is establishing a temporary safety zone on the Columbia River within a 500-yard radius of the small boat ``Nessy'' while in the area of Sand Island, near Chinook, WA, during Double- Crested Cormorant removal operations being conducted by the U.S. Army Corps of Engineers and U.S. Department of Agriculture Wildlife Services. This rule prohibits all persons and vessels from being in the safety zone unless authorized by the Captain of the Port Sector Columbia River (COTP), or a designated representative. We invite your comments on this rulemaking.",Temporary interim rule; request for comments.,Rule,"{'name': 'Donald Trump', 'identifier': 'donald-trump'}","This rule is effective from April 3, 2017, through May 25, 2017. Comments and related material must be received by the Coast Guard on or before March 24, 2017.",82 FR 12416,2017-04196,1625-AA00,https://www.federalregister.gov/api/v1/documents/2017-04196?publication_date=2017-03-03,https://www.federalregister.gov/documents/full_text/text/2017/03/03/2017-04196.txt,https://www.federalregister.gov/documents/2017/03/03/2017-04196/safety-zone-columbia-river-sand-island-wa,donald-trump,2017-03-03 00:00:00 UTC,2017,3,0,0
2017-04-27,2017-04-26,"[{'raw_name': 'DEPARTMENT OF COMMERCE', 'name': 'Commerce Department', 'id': 54, 'url': 'https://www.federalregister.gov/agencies/commerce-department', 'json_url': 'https://www.federalregister.gov/api/v1/agencies/54', 'parent_id': None, 'slug': 'commerce-department'}, {'raw_name': 'National Oceanic and Atmospheric Administration', 'name': 'National Oceanic and Atmospheric Administration', 'id': 361, 'url': 'https://www.federalregister.gov/agencies/national-oceanic-and-atmospheric-administration', 'json_url': 'https://www.federalregister.gov/api/v1/agencies/361', 'parent_id': 54, 'slug': 'national-oceanic-and-atmospheric-administration'}]","Commerce Department, National Oceanic and Atmospheric Administration",Takes of Marine Mammals Incidental to Specified Activities; U.S. Navy Training Activities in the Gulf of Alaska Temporary Maritime Activities Area,"Upon application from the U.S. Navy (Navy), we (NMFS) are issuing regulations under the Marine Mammal Protection Act (MMPA) to govern the unintentional taking of marine mammals incidental to the training activities conducted in the Gulf of Alaska (GOA) Temporary Maritime Activities Area (TMAA) Study Area (hereafter referred to the Study Area) from May 2017 through May 2022. These regulations allow us to issue a Letter of Authorization (LOA) for the incidental take of marine mammals during the Navy's specified activities and timeframes, set forth the permissible methods of taking, set forth other means of effecting the least practicable adverse impact on marine mammal species or stocks and their habitat, and set forth requirements pertaining to the monitoring and reporting of the incidental take.",Final rule.,Rule,"{'name': 'Donald Trump', 'identifier': 'donald-trump'}","Effective April 26, 2017, through April 26, 2022.",82 FR 19530,2017-08424,0648-BE67,https://www.federalregister.gov/api/v1/documents/2017-08424?publication_date=2017-04-27,https://www.federalregister.gov/documents/full_text/text/2017/04/27/2017-08424.txt,https://www.federalregister.gov/documents/2017/04/27/2017-08424/takes-of-marine-mammals-incidental-to-specified-activities-us-navy-training-activities-in-the-gulf,donald-trump,2017-04-27 00:00:00 UTC,2017,4,0,0
2021-03-10,2021-03-25,"[{'raw_name': 'DEPARTMENT OF TRANSPORTATION', 'name': 'Transportation Department', 'id': 492, 'url': 'https://www.federalregister.gov/agencies/transportation-department', 'json_url': 'https://www.federalregister.gov/api/v1/agencies/492', 'parent_id': None, 'slug': 'transportation-department'}, {'raw_name': 'Federal Aviation Administration', 'name': 'Federal Aviation Administration', 'id': 159, 'url': 'https://www.federalregister.gov/agencies/federal-aviation-administration', 'json_url': 'https://www.federalregister.gov/api/v1/agencies/159', 'parent_id': 492, 'slug': 'federal-aviation-administration'}]","Transportation Department, Federal Aviation Administration",Airworthiness Directives; Airbus Helicopters,"The FAA is superseding Airworthiness Directive (AD) 2020-23- 02, which applied to all Airbus Helicopters Model EC225LP helicopters. AD 2020-23-02 required repetitive inspections of the bearing in the swashplate assembly of the main rotor mast assembly for discrepancies (ceramic balls that have a hard point or sensitive axial play or both) and, depending on the findings, replacement of an affected main rotor mast assembly with a serviceable main rotor mast assembly. Since the FAA issued AD 2020-23-02, the FAA has determined additional main rotor mast assemblies are affected by the unsafe condition. This AD continues to require the actions specified in AD 2020-23-02, and also includes additional affected main rotor mast assemblies; as specified in a European Union Aviation Safety Agency (EASA) AD, which is incorporated by reference. The FAA is issuing this AD to address the unsafe condition on these products.",Final rule; request for comments.,Rule,"{'name': 'Joe Biden', 'identifier': 'joe-biden'}","This AD becomes effective March 25, 2021.",86 FR 13637,2021-04869,2120-AA64,https://www.federalregister.gov/api/v1/documents/2021-04869?publication_date=2021-03-10,https://www.federalregister.gov/documents/full_text/text/2021/03/10/2021-04869.txt,https://www.federalregister.gov/documents/2021/03/10/2021-04869/airworthiness-directives-airbus-helicopters,joe-biden,2021-03-10 00:00:00 UTC,2021,3,0,0
2021-03-12,2021-04-16,"[{'raw_name': 'DEPARTMENT OF TRANSPORTATION', 'name': 'Transportation Department', 'id': 492, 'url': 'https://www.federalregister.gov/agencies/transportation-department', 'json_url': 'https://www.federalregister.gov/api/v1/agencies/492', 'parent_id': None, 'slug': 'transportation-department'}, {'raw_name': 'Federal Aviation Administration', 'name': 'Federal Aviation Administration', 'id': 159, 'url': 'https://www.federalregister.gov/agencies/federal-aviation-administration', 'json_url': 'https://www.federalregister.gov/api/v1/agencies/159', 'parent_id': 492, 'slug': 'federal-aviation-administration'}]","Transportation Department, Federal Aviation Administration",Airworthiness Directives; Airbus Helicopters,"The FAA is adopting a new airworthiness directive (AD) for all Airbus Helicopters Model AS350B, AS350BA, AS350B1, AS350B2, AS350B3, AS350C, and AS350D helicopters; Model AS355E, AS355F, AS355F1, AS355F2, AS355N, and AS355NP helicopters; and Model EC130B4 and EC130T2 helicopters. This AD was prompted by a report of failed main rotor hub- to-mast attachment screws. This AD requires determining whether the helicopter has been operated in a severe environment since the last inspection of the main rotor hub-to-mast attachment screws, an inspection of the main rotor hub-to-mast attachment screws if the helicopter has been operated in a severe environment, and replacement of the main rotor hub-to-mast attachment screws if necessary, as specified in a European Aviation Safety Agency (now European Union Aviation Safety Agency) (EASA) AD, which is incorporated by reference. The FAA is issuing this AD to address the unsafe condition on these products.",Final rule.,Rule,"{'name': 'Joe Biden', 'identifier': 'joe-biden'}","This AD is effective April 16, 2021.",86 FR 13982,2021-05151,2120-AA64,https://www.federalregister.gov/api/v1/documents/2021-05151?publication_date=2021-03-12,https://www.federalregister.gov/documents/full_text/text/2021/03/12/2021-05151.txt,https://www.federalregister.gov/documents/2021/03/12/2021-05151/airworthiness-directives-airbus-helicopters,joe-biden,2021-03-12 00:00:00 UTC,2021,3,0,0
2021-04-29,2021-04-29,"[{'raw_name': 'FEDERAL COMMUNICATIONS COMMISSION', 'name': 'Federal Communications Commission', 'id': 161, 'url': 'https://www.federalregister.gov/agencies/federal-communications-commission', 'json_url': 'https://www.federalregister.gov/api/v1/agencies/161', 'parent_id': None, 'slug': 'federal-communications-commission'}]",Federal Communications Commission,"All-Digital AM Broadcasting, Revitalization of the AM Radio Service","In this document, the Commission announces that the Office of Management and Budget has approved a revision to the information collection requirements under OMB Control Number 3060-1034 associated with new or amended rules adopted in the Federal Communications Commission's All-Digital AM Broadcasting Report and Order, FCC 20-154, governing the contents of all-digital notifications submitted using the Digital Notification Form, FCC Form 335-AM, and that compliance with these rules is now required. This document is consistent with the All- Digital AM Broadcasting Report and Order, which states that the Commission will publish a document in the Federal Register announcing the effective date for these new or amended rule sections and revise the rules accordingly.",Final rule; announcement of effective date.,Rule,"{'name': 'Joe Biden', 'identifier': 'joe-biden'}","The addition of 47 CFR 73.406, published at 85 FR 78022 on December 3, 2020, is effective April 29, 2021.",86 FR 22621,2021-08424,,https://www.federalregister.gov/api/v1/documents/2021-08424?publication_date=2021-04-29,https://www.federalregister.gov/documents/full_text/text/2021/04/29/2021-08424.txt,https://www.federalregister.gov/documents/2021/04/29/2021-08424/all-digital-am-broadcasting-revitalization-of-the-am-radio-service,joe-biden,2021-04-29 00:00:00 UTC,2021,4,0,0
2021-03-10,2021-04-21,"[{'raw_name': 'DEPARTMENT OF TRANSPORTATION', 'name': 'Transportation Department', 'id': 492, 'url': 'https://www.federalregister.gov/agencies/transportation-department', 'json_url': 'https://www.federalregister.gov/api/v1/agencies/492', 'parent_id': None, 'slug': 'transportation-department'}, {'raw_name': 'Federal Aviation Administration', 'name': 'Federal Aviation Administration', 'id': 159, 'url': 'https://www.federalregister.gov/agencies/federal-aviation-administration', 'json_url': 'https://www.federalregister.gov/api/v1/agencies/159', 'parent_id': 492, 'slug': 'federal-aviation-administration'}]","Transportation Department, Federal Aviation Administration",Remote Identification of Unmanned Aircraft; Delay,"In accordance with the memorandum of January 20, 2021, from the Assistant to the President and Chief of Staff, titled ``Regulatory Freeze Pending Review,'' the Agency delays the March 16, 2021, effective date of the final rule, ``Remote Identification of Unmanned Aircraft'', until April 21, 2021. As a result of the delay in the effective date, the Agency is also delaying the compliance date for the production requirements for remote identification broadcast modules by correcting the regulatory text.",Final rule; delay of effective and compliance date; correction.,Rule,"{'name': 'Joe Biden', 'identifier': 'joe-biden'}","As of March 10, 2021, the March 16, 2021, the effective date of the final rule published on January 15, 2021, at 86 FR 4390, is delayed to April 21, 2021.",86 FR 13629,2021-04882,2120-AL31,https://www.federalregister.gov/api/v1/documents/2021-04882?publication_date=2021-03-10,https://www.federalregister.gov/documents/full_text/text/2021/03/10/2021-04882.txt,https://www.federalregister.gov/documents/2021/03/10/2021-04882/remote-identification-of-unmanned-aircraft-delay,joe-biden,2021-03-10 00:00:00 UTC,2021,3,1,1
2021-03-31,2019-12-20,"[{'raw_name': 'DEPARTMENT OF COMMERCE', 'name': 'Commerce Department', 'id': 54, 'url': 'https://www.federalregister.gov/agencies/commerce-department', 'json_url': 'https://www.federalregister.gov/api/v1/agencies/54', 'parent_id': None, 'slug': 'commerce-department'}, {'raw_name': 'National Oceanic and Atmospheric Administration', 'name': 'National Oceanic and Atmospheric Administration', 'id': 361, 'url': 'https://www.federalregister.gov/agencies/national-oceanic-and-atmospheric-administration', 'json_url': 'https://www.federalregister.gov/api/v1/agencies/361', 'parent_id': 54, 'slug': 'national-oceanic-and-atmospheric-administration'}]","Commerce Department, National Oceanic and Atmospheric Administration",Sea Turtle Conservation; Shrimp Trawling Requirements,"We, the NMFS, are delaying the effective date of a final rule that published on December 20, 2019.",Final rule; delay of effective date.,Rule,"{'name': 'Joe Biden', 'identifier': 'joe-biden'}","As of March 31, 2021, the effective date of the rule amending 50 CFR part 223 that published at 84 FR 70048 on December 20, 2019, is delayed until August 1, 2021.",86 FR 16676,2021-06594,0648-BK45,https://www.federalregister.gov/api/v1/documents/2021-06594?publication_date=2021-03-31,https://www.federalregister.gov/documents/full_text/text/2021/03/31/2021-06594.txt,https://www.federalregister.gov/documents/2021/03/31/2021-06594/sea-turtle-conservation-shrimp-trawling-requirements,joe-biden,2021-03-31 00:00:00 UTC,2021,3,1,1
2021-02-23,2021-03-26,"[{'raw_name': 'LIBRARY OF CONGRESS', 'name': 'Library of Congress', 'id': 277, 'url': 'https://www.federalregister.gov/agencies/library-of-congress', 'json_url': 'https://www.federalregister.gov/api/v1/agencies/277', 'parent_id': None, 'slug': 'library-of-congress'}, {'raw_name': 'Copyright Office', 'name': 'Copyright Office, Library of Congress', 'id': 87, 'url': 'https://www.federalregister.gov/agencies/copyright-office-library-of-congress', 'json_url': 'https://www.federalregister.gov/api/v1/agencies/87', 'parent_id': 277, 'slug': 'copyright-office-library-of-congress'}]","Library of Congress, Copyright Office, Library of Congress",Group Registration of Works on an Album of Music,"The U.S. Copyright Office is creating a new group registration option for musical works, sound recordings, and certain other works contained on an album. This option will permit the registration of a group of musical works or a group of sound recordings distributed together, regardless of whether such distribution occurs via physical or digital media. The final rule generally adopts the provisions set forth in the May 2019 notice of proposed rulemaking in this proceeding, with certain updates to reflect the planned implementation of new online applications for this option.",Final rule.,Rule,"{'name': 'Joe Biden', 'identifier': 'joe-biden'}","Effective March 26, 2021.",86 FR 10820,2021-03533,,https://www.federalregister.gov/api/v1/documents/2021-03533?publication_date=2021-02-23,https://www.federalregister.gov/documents/full_text/text/2021/02/23/2021-03533.txt,https://www.federalregister.gov/documents/2021/02/23/2021-03533/group-registration-of-works-on-an-album-of-music,joe-biden,2021-02-23 00:00:00 UTC,2021,2,0,0
2021-04-28,2021-04-28,"[{'raw_name': 'DEPARTMENT OF THE TREASURY', 'name': 'Treasury Department', 'id': 497, 'url': 'https://www.federalregister.gov/agencies/treasury-department', 'json_url': 'https://www.federalregister.gov/api/v1/agencies/497', 'parent_id': None, 'slug': 'treasury-department'}, {'raw_name': 'Internal Revenue Service', 'name': 'Internal Revenue Service', 'id': 254, 'url': 'https://www.federalregister.gov/agencies/internal-revenue-service', 'json_url': 'https://www.federalregister.gov/api/v1/agencies/254', 'parent_id': 497, 'slug': 'internal-revenue-service'}]","Treasury Department, Internal Revenue Service","Qualified Transportation Fringe, Transportation and Commuting Expenses Under Section 274; Correction","This document contains corrections to the final regulations (Treasury Decision 9939), that were published in the Federal Register on Wednesday, December 16, 2020. The final regulations provide guidance regarding the elimination of the deduction for expenses related to certain transportation and commuting benefits provided by employers to their employees. The final regulations affect taxpayers who pay or incur such expenses.",Correcting amendments.,Rule,"{'name': 'Joe Biden', 'identifier': 'joe-biden'}","These corrections are effective on April 28, 2021 and applicable for taxable years beginning on or after December 16, 2020.",86 FR 22345,2021-08391,1545-BP49,https://www.federalregister.gov/api/v1/documents/2021-08391?publication_date=2021-04-28,https://www.federalregister.gov/documents/full_text/text/2021/04/28/2021-08391.txt,https://www.federalregister.gov/documents/2021/04/28/2021-08391/qualified-transportation-fringe-transportation-and-commuting-expenses-under-section-274-correction,joe-biden,2021-04-28 00:00:00 UTC,2021,4,0,0
2021-03-02,2021-03-02,"[{'raw_name': 'FEDERAL TRADE COMMISSION', 'name': 'Federal Trade Commission', 'id': 192, 'url': 'https://www.federalregister.gov/agencies/federal-trade-commission', 'json_url': 'https://www.federalregister.gov/api/v1/agencies/192', 'parent_id': None, 'slug': 'federal-trade-commission'}]",Federal Trade Commission,Prohibition of Energy Market Manipulation Rule Review,The Federal Trade Commission (``Commission'') has completed its regulatory review of its Prohibition of Energy Market Manipulation Rule implementing Section 811 of Subtitle B of Title VIII of the Energy Independence and Security Act of 2007. This regulatory review is part of the Commission's periodic review of all its regulations and guides. The Commission has determined to retain the Rule in its present form.,Confirmation of rule.,Rule,"{'name': 'Joe Biden', 'identifier': 'joe-biden'}","This action is effective March 2, 2021.",86 FR 12091,2021-04196,,https://www.federalregister.gov/api/v1/documents/2021-04196?publication_date=2021-03-02,https://www.federalregister.gov/documents/full_text/text/2021/03/02/2021-04196.txt,https://www.federalregister.gov/documents/2021/03/02/2021-04196/prohibition-of-energy-market-manipulation-rule-review,joe-biden,2021-03-02 00:00:00 UTC,2021,3,0,0
